Title,URL,Description,Details,ShortDetails,Resource,Type,Identifiers,Db,EntrezUID,Properties
"Suture Button Versus Syndesmotic Screw for Syndesmosis Injuries: A Meta-analysis of Randomized Controlled Trials.","/pubmed/30475639","Shimozono Y, Hurley ET, Myerson CL, Murawski CD, Kennedy JG.","Am J Sports Med. 2019 Sep;47(11):2764-2771. doi: 10.1177/0363546518804804. Epub 2018 Nov 26.","Am J Sports Med.  2019","PubMed","citation","PMID:30475639","pubmed","30475639","create date:2018/11/27 | first author:Shimozono Y",
"Pre-participation health evaluation in adolescent athletes competing at Youth Olympic Games: proposal for a tailored protocol.","/pubmed/30448781","Adami PE, Squeo MR, Quattrini FM, Di Paolo FM, Pisicchio C, Di Giacinto B, Lemme E, Maestrini V, Pelliccia A.","Br J Sports Med. 2019 Sep;53(17):1111-1116. doi: 10.1136/bjsports-2018-099651. Epub 2018 Nov 17.","Br J Sports Med.  2019","PubMed","citation","PMID:30448781","pubmed","30448781","create date:2018/11/19 | first author:Adami PE",
"Timeline for Maximal Subjective Outcome Improvement After Anterior Cruciate Ligament Reconstruction.","/pubmed/30419175","Agarwalla A, Puzzitiello RN, Liu JN, Cvetanovich GL, Gowd AK, Verma NN, Cole BJ, Forsythe B.","Am J Sports Med. 2019 Aug;47(10):2501-2509. doi: 10.1177/0363546518803365. Epub 2018 Nov 12.","Am J Sports Med.  2019","PubMed","citation","PMID:30419175","pubmed","30419175","create date:2018/11/13 | first author:Agarwalla A",
"Current Concepts in the Operative Management of Acromioclavicular Dislocations: A Systematic Review and Meta-analysis of Operative Techniques.","/pubmed/30272997","Gowd AK, Liu JN, Cabarcas BC, Cvetanovich GL, Garcia GH, Manderle BJ, Verma NN.","Am J Sports Med. 2019 Sep;47(11):2745-2758. doi: 10.1177/0363546518795147. Epub 2018 Oct 1.","Am J Sports Med.  2019","PubMed","citation","PMID:30272997","pubmed","30272997","create date:2018/10/03 | first author:Gowd AK",
"The King-Devick test is not sensitive to self-reported history of concussion but is affected by English language skill.","/pubmed/30193857","Dickson TJ, Waddington G, Terwiel FA, Elkington L.","J Sci Med Sport. 2019 Aug;22 Suppl 1:S34-S38. doi: 10.1016/j.jsams.2018.08.013. Epub 2018 Aug 23.","J Sci Med Sport.  2019","PubMed","citation","PMID:30193857","pubmed","30193857","create date:2018/09/09 | first author:Dickson TJ",
"Management of Recurrent Anterior Shoulder Instability With Bipolar Bone Loss: A Systematic Review to Assess Critical Bone Loss Amounts.","/pubmed/30148653","Gowd AK, Liu JN, Cabarcas BC, Garcia GH, Cvetanovich GL, Provencher MT, Verma NN.","Am J Sports Med. 2019 Aug;47(10):2484-2493. doi: 10.1177/0363546518791555. Epub 2018 Aug 27.","Am J Sports Med.  2019","PubMed","citation","PMID:30148653","pubmed","30148653","create date:2018/08/28 | first author:Gowd AK",
"Impact of exercise on articular cartilage in people at risk of, or with established, knee osteoarthritis: a systematic review of randomised controlled trials.","/pubmed/29934429","Bricca A, Juhl CB, Steultjens M, Wirth W, Roos EM.","Br J Sports Med. 2019 Aug;53(15):940-947. doi: 10.1136/bjsports-2017-098661. Epub 2018 Jun 22.","Br J Sports Med.  2019","PubMed","citation","PMID:29934429","pubmed","29934429","create date:2018/06/24 | first author:Bricca A",
"Reply to the comments on: concurrent aerobic plus resistance exercise versus aerobic exercise alone to improve health outcomes in paediatric obesity: a systematic review and meta-analysis.","/pubmed/29678892","García-Hermoso A, Ramírez-Vélez R, Ramírez-Campillo R, Peterson MD, Martínez-Vizcaíno V.","Br J Sports Med. 2019 Aug;53(16):1045-1046. doi: 10.1136/bjsports-2018-099416. Epub 2018 Apr 20. No abstract available. ","Br J Sports Med.  2019","PubMed","citation","PMID:29678892","pubmed","29678892","create date:2018/04/22 | first author:García-Hermoso A",
"Sports-related injuries in New Zealand: National Insurance (Accident Compensation Corporation) claims for five sporting codes from 2012 to 2016.","/pubmed/29530942","King D, Hume PA, Hardaker N, Cummins C, Gissane C, Clark T.","Br J Sports Med. 2019 Aug;53(16):1026-1033. doi: 10.1136/bjsports-2017-098533. Epub 2018 Mar 12.","Br J Sports Med.  2019","PubMed","citation","PMID:29530942","pubmed","29530942","create date:2018/03/14 | first author:King D",
"What's my risk of sustaining an ACL injury while playing sports?"" A systematic review with meta-analysis.","/pubmed/29514822","Montalvo AM, Schneider DK, Yut L, Webster KE, Beynnon B, Kocher MS, Myer GD.","Br J Sports Med. 2019 Aug;53(16):1003-1012. doi: 10.1136/bjsports-2016-096274. Epub 2018 Mar 7.","Br J Sports Med.  2019","PubMed","citation","PMID:29514822 | PMCID:PMC6561829","pubmed","29514822","create date:2018/03/09 | first author:Montalvo AM",
"Smartphone application for the general public (mobile app review).","/pubmed/29439948","Killingback C, Dore-Smith E, Wakeman N, Searles L, Ahmed O.","Br J Sports Med. 2019 Aug;53(16):1043-1044. doi: 10.1136/bjsports-2017-098832. Epub 2018 Feb 13. No abstract available. ","Br J Sports Med.  2019","PubMed","citation","PMID:29439948","pubmed","29439948","create date:2018/02/15 | first author:Killingback C",
"Broad-spectrum physical fitness benefits of recreational football: a systematic review and meta-analysis.","/pubmed/29371223","Milanović Z, Pantelić S, Čović N, Sporiš G, Mohr M, Krustrup P.","Br J Sports Med. 2019 Aug;53(15):926-939. doi: 10.1136/bjsports-2017-097885. Epub 2018 Jan 25.","Br J Sports Med.  2019","PubMed","citation","PMID:29371223 | PMCID:PMC6662951","pubmed","29371223","create date:2018/01/27 | first author:Milanović Z",
"Programme frequency, type, time and duration do not explain the effects of balance exercise in older adults: a systematic review with a meta-regression analysis.","/pubmed/29371222","Farlie MK, Robins L, Haas R, Keating JL, Molloy E, Haines TP.","Br J Sports Med. 2019 Aug;53(16):996-1002. doi: 10.1136/bjsports-2016-096874. Epub 2018 Jan 25.","Br J Sports Med.  2019","PubMed","citation","PMID:29371222","pubmed","29371222","create date:2018/01/27 | first author:Farlie MK",
"Zombie reviews taking over the PROSPERO systematic review registry. It's time to fight back!","/pubmed/29021246","Andrade R, Pereira R, Weir A, Ardern CL, Espregueira-Mendes J.","Br J Sports Med. 2019 Aug;53(15):919-921. doi: 10.1136/bjsports-2017-098252. Epub 2017 Oct 11. No abstract available. ","Br J Sports Med.  2019","PubMed","citation","PMID:29021246","pubmed","29021246","create date:2017/10/13 | first author:Andrade R",
"Tackling concussion in professional rugby union: a case-control study of tackle-based risk factors and recommendations for primary prevention.","/pubmed/29021244","Cross MJ, Tucker R, Raftery M, Hester B, Williams S, Stokes KA, Ranson C, Mathema P, Kemp S.","Br J Sports Med. 2019 Aug;53(16):1021-1025. doi: 10.1136/bjsports-2017-097912. Epub 2017 Oct 11.","Br J Sports Med.  2019","PubMed","citation","PMID:29021244","pubmed","29021244","create date:2017/10/13 | first author:Cross MJ",
"Response to: 'A reminder of the importance of not losing the forest through the trees in the appraisal of systematic review findings'.","/pubmed/28483927","Focht BC, Fairman CM.","Br J Sports Med. 2019 Aug;53(15):984. doi: 10.1136/bjsports-2017-097778. Epub 2017 May 8. No abstract available. ","Br J Sports Med.  2019","PubMed","citation","PMID:28483927","pubmed","28483927","create date:2017/05/10 | first author:Focht BC",
"Appraising the exercise oncology literature: a reminder of the rigour needed in systematic reviews.","/pubmed/28341728","Neil-Sztramko SE, Winters-Stone KM, Bland KA, Campbell KL.","Br J Sports Med. 2019 Aug;53(15):983-984. doi: 10.1136/bjsports-2017-097697. Epub 2017 Mar 24. No abstract available. ","Br J Sports Med.  2019","PubMed","citation","PMID:28341728","pubmed","28341728","create date:2017/03/28 | first author:Neil-Sztramko SE",
"Review of criterion-referenced standards for cardiorespiratory fitness: what percentage of 1 142 026 international children and youth are apparently healthy?","/pubmed/28254744","Lang JJ, Tremblay MS, Ortega FB, Ruiz JR, Tomkinson GR.","Br J Sports Med. 2019 Aug;53(15):953-958. doi: 10.1136/bjsports-2016-096955. Epub 2017 Mar 2.","Br J Sports Med.  2019","PubMed","citation","PMID:28254744","pubmed","28254744","create date:2017/03/04 | first author:Lang JJ",
