Title,URL,Description,Details,ShortDetails,Resource,Type,Identifiers,Db,EntrezUID,Properties
"Efficacy of School-Based Interventions for Improving Muscular Fitness Outcomes in Adolescent Boys: A Systematic Review and Meta-analysis.","/pubmed/31729638","Cox A, Fairclough SJ, Kosteli MC, Noonan RJ.","Sports Med. 2019 Nov 15. doi: 10.1007/s40279-019-01215-5. [Epub ahead of print] Review.","Sports Med.  2019","PubMed","citation","PMID:31729638","pubmed","31729638","create date:2019/11/16 | first author:Cox A",
"Impact of Pre-exercise Hypohydration on Aerobic Exercise Performance, Peak Oxygen Consumption and Oxygen Consumption at Lactate Threshold: A Systematic Review with Meta-analysis.","/pubmed/31728846","Deshayes TA, Jeker D, Goulet EDB.","Sports Med. 2019 Nov 14. doi: 10.1007/s40279-019-01223-5. [Epub ahead of print] Review.","Sports Med.  2019","PubMed","citation","PMID:31728846","pubmed","31728846","create date:2019/11/16 | first author:Deshayes TA",
"Correction: Arthrogenic muscle inhibition after ACL reconstruction: a scoping review of the efficacy of interventions.","/pubmed/31727726","[No authors listed]","Br J Sports Med. 2019 Dec;53(23):e8. doi: 10.1136/bjsports-2017-098401corr1. No abstract available. ","Br J Sports Med.  2019","PubMed","citation","PMID:31727726 | PMCID:PMC6900231","pubmed","31727726","create date:2019/11/16",
"Standardised criteria for classifying the International Classification of Activities for Time-use Statistics (ICATUS) activity groups into sleep, sedentary behaviour, and physical activity.","/pubmed/31727080","Liangruenrom N, Craike M, Dumuid D, Biddle SJH, Tudor-Locke C, Ainsworth B, Jalayondeja C, van Tienoven TP, Lachapelle U, Weenas D, Berrigan D, Olds T, Pedisic Z.","Int J Behav Nutr Phys Act. 2019 Nov 14;16(1):106. doi: 10.1186/s12966-019-0875-5.","Int J Behav Nutr Phys Act.  2019","PubMed","citation","PMID:31727080 | PMCID:PMC6857154","pubmed","31727080","create date:2019/11/16 | first author:Liangruenrom N",
"A Contemporary Look at the Evaluation and Treatment of Adult Borderline and Frank Hip Dysplasia.","/pubmed/31725329","Kraeutler MJ, Safran MR, Scillia AJ, Ayeni OR, Garabekyan T, Mei-Dan O.","Am J Sports Med. 2019 Nov 14:363546519881411. doi: 10.1177/0363546519881411. [Epub ahead of print]","Am J Sports Med.  2019","PubMed","citation","PMID:31725329","pubmed","31725329","create date:2019/11/15 | first author:Kraeutler MJ",
"The link between diabetes and atherosclerosis.","/pubmed/31722564","La Sala L, Prattichizzo F, Ceriello A.","Eur J Prev Cardiol. 2019 Dec;26(2_suppl):15-24. doi: 10.1177/2047487319878373. Epub 2019 Nov 13.","Eur J Prev Cardiol.  2019","PubMed","citation","PMID:31722564","pubmed","31722564","create date:2019/11/15 | first author:La Sala L",
"Diabetes as a cardiovascular risk factor: An overview of global trends of macro and micro vascular complications.","/pubmed/31722562","Dal Canto E, Ceriello A, Rydén L, Ferrini M, Hansen TB, Schnell O, Standl E, Beulens JW.","Eur J Prev Cardiol. 2019 Dec;26(2_suppl):25-32. doi: 10.1177/2047487319878371. Epub 2019 Nov 13.","Eur J Prev Cardiol.  2019","PubMed","citation","PMID:31722562","pubmed","31722562","create date:2019/11/15 | first author:Dal Canto E",
"Management of patients with type 2 diabetes in cardiovascular rehabilitation.","/pubmed/31722560","Hansen D, Kraenkel N, Kemps H, Wilhelm M, Abreu A, Pfeiffer AF, Jordão A, Cornelissen V, Völler H.","Eur J Prev Cardiol. 2019 Dec;26(2_suppl):133-144. doi: 10.1177/2047487319882820. Epub 2019 Nov 13.","Eur J Prev Cardiol.  2019","PubMed","citation","PMID:31722560","pubmed","31722560","create date:2019/11/15 | first author:Hansen D",
"Quantification of Neuromuscular Fatigue: What Do We Do Wrong and Why?","/pubmed/31713783","Place N, Millet GY.","Sports Med. 2019 Nov 12. doi: 10.1007/s40279-019-01203-9. [Epub ahead of print]","Sports Med.  2019","PubMed","citation","PMID:31713783","pubmed","31713783","create date:2019/11/13 | first author:Place N",
"The Safety of Blood Flow Restriction Training as a Therapeutic Intervention for Patients With Musculoskeletal Disorders: A Systematic Review.","/pubmed/31710505","Minniti MC, Statkevich AP, Kelly RL, Rigsby VP, Exline MM, Rhon DI, Clewley D.","Am J Sports Med. 2019 Nov 11:363546519882652. doi: 10.1177/0363546519882652. [Epub ahead of print]","Am J Sports Med.  2019","PubMed","citation","PMID:31710505","pubmed","31710505","create date:2019/11/12 | first author:Minniti MC",
"Modifiable lifestyle risk factors and C-reactive protein in patients with coronary artery disease: Implications for an anti-inflammatory treatment target population.","/pubmed/31707846","Blaum C, Brunner FJ, Kröger F, Braetz J, Lorenz T, Goßling A, Ojeda F, Koester L, Karakas M, Zeller T, Westermann D, Schnabel R, Blankenberg S, Seiffert M, Waldeyer C.","Eur J Prev Cardiol. 2019 Nov 10:2047487319885458. doi: 10.1177/2047487319885458. [Epub ahead of print]","Eur J Prev Cardiol.  2019","PubMed","citation","PMID:31707846","pubmed","31707846","create date:2019/11/12 | first author:Blaum C",
"Resistance Exercise-induced Regulation of Muscle Protein Synthesis to Intraset Rest.","/pubmed/31703023","Salvador AF, Askow AT, McKenna CF, Fang HY, Burke SK, Li Z, Ulanov AV, Paluska SA, Petruzzello SJ, Boppart MD, Oliver JM, Burd NA.","Med Sci Sports Exerc. 2019 Nov 6. doi: 10.1249/MSS.0000000000002213. [Epub ahead of print]","Med Sci Sports Exerc.  2019","PubMed","citation","PMID:31703023","pubmed","31703023","create date:2019/11/09 | first author:Salvador AF",
"The Influence of Psychological Factors on the Incidence and Severity of Sports-Related Concussions: A Systematic Review.","/pubmed/31702943","Trinh LN, Brown SM, Mulcahey MK.","Am J Sports Med. 2019 Nov 8:363546519882626. doi: 10.1177/0363546519882626. [Epub ahead of print]","Am J Sports Med.  2019","PubMed","citation","PMID:31702943","pubmed","31702943","create date:2019/11/09 | first author:Trinh LN",
"Implementation and scale-up of physical activity and behavioural nutrition interventions: an evaluation roadmap.","/pubmed/31699095","McKay H, Naylor PJ, Lau E, Gray SM, Wolfenden L, Milat A, Bauman A, Race D, Nettlefold L, Sims-Gould J.","Int J Behav Nutr Phys Act. 2019 Nov 7;16(1):102. doi: 10.1186/s12966-019-0868-4.","Int J Behav Nutr Phys Act.  2019","PubMed","citation","PMID:31699095 | PMCID:PMC6839114","pubmed","31699095","create date:2019/11/09 | first author:McKay H",
"Ticagrelor versus prasugrel for secondary prevention after percutaneous coronary intervention: A systematic review and meta-analysis.","/pubmed/31698964","Ahmed J, Hasnain N, Malik F, Siddiqi TJ, Usman MS, Alkhouli M.","Eur J Prev Cardiol. 2019 Nov 7:2047487319885194. doi: 10.1177/2047487319885194. [Epub ahead of print] No abstract available. ","Eur J Prev Cardiol.  2019","PubMed","citation","PMID:31698964","pubmed","31698964","create date:2019/11/09 | first author:Ahmed J",
"Muscle Cramping During Exercise: Causes, Solutions, and Questions Remaining.","/pubmed/31696455","Maughan RJ, Shirreffs SM.","Sports Med. 2019 Dec;49(Suppl 2):115-124. doi: 10.1007/s40279-019-01162-1. Review.","Sports Med.  2019","PubMed","citation","PMID:31696455 | PMCID:PMC6901412","pubmed","31696455","create date:2019/11/07 | first author:Maughan RJ",
"Nutrition and Athlete Bone Health.","/pubmed/31696454","Sale C, Elliott-Sale KJ.","Sports Med. 2019 Dec;49(Suppl 2):139-151. doi: 10.1007/s40279-019-01161-2. Review.","Sports Med.  2019","PubMed","citation","PMID:31696454 | PMCID:PMC6901417","pubmed","31696454","create date:2019/11/07 | first author:Sale C",
"Does Hypohydration Really Impair Endurance Performance? Methodological Considerations for Interpreting Hydration Research.","/pubmed/31696453","James LJ, Funnell MP, James RM, Mears SA.","Sports Med. 2019 Dec;49(Suppl 2):103-114. doi: 10.1007/s40279-019-01188-5. Review.","Sports Med.  2019","PubMed","citation","PMID:31696453 | PMCID:PMC6901416","pubmed","31696453","create date:2019/11/07 | first author:James LJ",
"The Role of Energy Availability in Reproductive Function in the Female Athlete Triad and Extension of its Effects to Men: An Initial Working Model of a Similar Syndrome in Male Athletes.","/pubmed/31696452","De Souza MJ, Koltun KJ, Williams NI.","Sports Med. 2019 Dec;49(Suppl 2):125-137. doi: 10.1007/s40279-019-01217-3. Review.","Sports Med.  2019","PubMed","citation","PMID:31696452 | PMCID:PMC6901401","pubmed","31696452","create date:2019/11/07 | first author:De Souza MJ",
"Reply to Borszcz & de Lucas: Comment on: ""Effects of Carbohydrate Mouth Rinse on Cycling Time Trial Performance: A Systematic Review and Meta-Analysis"".","/pubmed/31696451","Brietzke C, Franco-Alvarenga PE, Goethel MF, Santos TM, Pires FO.","Sports Med. 2019 Nov 6. doi: 10.1007/s40279-019-01212-8. [Epub ahead of print] No abstract available. ","Sports Med.  2019","PubMed","citation","PMID:31696451","pubmed","31696451","create date:2019/11/07 | first author:Brietzke C",
"Comment on: ""Effects of Carbohydrate Mouth Rinse on Cycling Time Trial Performance: A Systematic Review and Meta-analysis"" and Subsequent Comment/Author Reply from Li et al.","/pubmed/31696450","Borszcz FK, de Lucas RD.","Sports Med. 2019 Nov 6. doi: 10.1007/s40279-019-01216-4. [Epub ahead of print] No abstract available. ","Sports Med.  2019","PubMed","citation","PMID:31696450","pubmed","31696450","create date:2019/11/07 | first author:Borszcz FK",
"Combined Transphyseal and Lateral Extra-articular Pediatric Anterior Cruciate Ligament Reconstruction: A Novel Technique to Reduce ACL Reinjury While Allowing for Growth.","/pubmed/31693388","Wilson PL, Wyatt CW, Wagner KJ 3rd, Boes N, Sabatino MJ, Ellis HB Jr.","Am J Sports Med. 2019 Dec;47(14):3356-3364. doi: 10.1177/0363546519881445. Epub 2019 Nov 6.","Am J Sports Med.  2019","PubMed","citation","PMID:31693388","pubmed","31693388","create date:2019/11/07 | first author:Wilson PL",
"Incidence and Healing Rates of Meniscal Tears in Patients Undergoing Repair During the First Stage of 2-Stage Revision Anterior Cruciate Ligament Reconstruction.","/pubmed/31693386","DePhillipo NN, Dekker TJ, Aman ZS, Bernholt D, Grantham WJ, LaPrade RF.","Am J Sports Med. 2019 Dec;47(14):3389-3395. doi: 10.1177/0363546519878421. Epub 2019 Nov 6.","Am J Sports Med.  2019","PubMed","citation","PMID:31693386","pubmed","31693386","create date:2019/11/07 | first author:DePhillipo NN",
"Blood Biomarker Profiling and Monitoring for High-Performance Physiology and Nutrition: Current Perspectives, Limitations and Recommendations.","/pubmed/31691931","Pedlar CR, Newell J, Lewis NA.","Sports Med. 2019 Dec;49(Suppl 2):185-198. doi: 10.1007/s40279-019-01158-x. Review.","Sports Med.  2019","PubMed","citation","PMID:31691931 | PMCID:PMC6901403","pubmed","31691931","create date:2019/11/07 | first author:Pedlar CR",
"Genetic Approaches for Sports Performance: How Far Away Are We?","/pubmed/31691930","Joyner MJ.","Sports Med. 2019 Dec;49(Suppl 2):199-204. doi: 10.1007/s40279-019-01164-z. Review.","Sports Med.  2019","PubMed","citation","PMID:31691930 | PMCID:PMC6901428","pubmed","31691930","create date:2019/11/07 | first author:Joyner MJ",
"Nutrition and Altitude: Strategies to Enhance Adaptation, Improve Performance and Maintain Health: A Narrative Review.","/pubmed/31691928","Stellingwerff T, Peeling P, Garvican-Lewis LA, Hall R, Koivisto AE, Heikura IA, Burke LM.","Sports Med. 2019 Dec;49(Suppl 2):169-184. doi: 10.1007/s40279-019-01159-w. Review.","Sports Med.  2019","PubMed","citation","PMID:31691928 | PMCID:PMC6901429","pubmed","31691928","create date:2019/11/07 | first author:Stellingwerff T",
"Nutrition and Athlete Immune Health: New Perspectives on an Old Paradigm.","/pubmed/31691927","Walsh NP.","Sports Med. 2019 Dec;49(Suppl 2):153-168. doi: 10.1007/s40279-019-01160-3. Review.","Sports Med.  2019","PubMed","citation","PMID:31691927 | PMCID:PMC6901425","pubmed","31691927","create date:2019/11/07 | first author:Walsh NP",
"The Association Between the Acute:Chronic Workload Ratio and Injury and its Application in Team Sports: A Systematic Review.","/pubmed/31691167","Griffin A, Kenny IC, Comyns TM, Lyons M.","Sports Med. 2019 Nov 5. doi: 10.1007/s40279-019-01218-2. [Epub ahead of print] Review.","Sports Med.  2019","PubMed","citation","PMID:31691167","pubmed","31691167","create date:2019/11/07 | first author:Griffin A",
"Activity Level Maintenance at Midterm Follow-up Among Active Patients Undergoing Periacetabular Osteotomy.","/pubmed/31689124","Okoroafor UC, Pascual-Garrido C, Schwabe MT, Nepple JJ, Schoenecker PL, Clohisy JC.","Am J Sports Med. 2019 Dec;47(14):3455-3459. doi: 10.1177/0363546519881421. Epub 2019 Nov 5.","Am J Sports Med.  2019","PubMed","citation","PMID:31689124","pubmed","31689124","create date:2019/11/07 | first author:Okoroafor UC",
"Rate of Return to Sport and Functional Outcomes After Bilateral Hip Arthroscopy in High-Level Athletes.","/pubmed/31689121","Rosinsky PJ, Kyin C, Lall AC, Shapira J, Maldonado DR, Domb BG.","Am J Sports Med. 2019 Dec;47(14):3444-3454. doi: 10.1177/0363546519885354. Epub 2019 Nov 5.","Am J Sports Med.  2019","PubMed","citation","PMID:31689121","pubmed","31689121","create date:2019/11/07 | first author:Rosinsky PJ",
"Association of Fish Oil and Physical Activity on Mobility Disability in Older Adults.","/pubmed/31688650","Balachandran A, Gundermann DM, Walkup MP, King AC, Ambrosius WT, Kritchevsky SB, Pahor M, Newman AB, Manini TM.","Med Sci Sports Exerc. 2019 Nov 1. doi: 10.1249/MSS.0000000000002195. [Epub ahead of print]","Med Sci Sports Exerc.  2019","PubMed","citation","PMID:31688650","pubmed","31688650","create date:2019/11/07 | first author:Balachandran A",
"Neuromuscular Electrical Stimulation Preserves Leg Lean Mass in Geriatric Patients.","/pubmed/31688649","Karlsen A, Cullum CK, Norheim KL, Scheel FU, Zinglersen AH, Vahlgren J, Schjerling P, Kjaer M, Mackey AL.","Med Sci Sports Exerc. 2019 Nov 1. doi: 10.1249/MSS.0000000000002191. [Epub ahead of print]","Med Sci Sports Exerc.  2019","PubMed","citation","PMID:31688649","pubmed","31688649","create date:2019/11/07 | first author:Karlsen A",
"Age-related Deficits in Voluntary Activation: A Systematic Review and Meta-analysis.","/pubmed/31688647","Rozand V, Sundberg CW, Hunter SK, Smith AE.","Med Sci Sports Exerc. 2019 Nov 1. doi: 10.1249/MSS.0000000000002179. [Epub ahead of print]","Med Sci Sports Exerc.  2019","PubMed","citation","PMID:31688647","pubmed","31688647","create date:2019/11/07 | first author:Rozand V",
"Planned Aerobic Exercise Increases Energy Intake at the Preceding Meal.","/pubmed/31688645","Barutcu A, Taylor S, McLeod CJ, Witcomb GL, James LJ.","Med Sci Sports Exerc. 2019 Nov 1. doi: 10.1249/MSS.0000000000002199. [Epub ahead of print]","Med Sci Sports Exerc.  2019","PubMed","citation","PMID:31688645","pubmed","31688645","create date:2019/11/07 | first author:Barutcu A",
"Correction to: How the 2018 US Physical Activity Guidelines are a Call to Promote and Better Understand Acute Physical Activity for Cognitive Function Gains.","/pubmed/31686384","Chang YK, Erickson KI, Stamatakis E, Hung TM.","Sports Med. 2019 Nov 4. doi: 10.1007/s40279-019-01225-3. [Epub ahead of print]","Sports Med.  2019","PubMed","citation","PMID:31686384","pubmed","31686384","create date:2019/11/07 | first author:Chang YK",
"Is running associated with a lower risk of all-cause, cardiovascular and cancer mortality, and is the more the better? A systematic review and meta-analysis.","/pubmed/31685526","Pedisic Z, Shrestha N, Kovalchik S, Stamatakis E, Liangruenrom N, Grgic J, Titze S, Biddle SJ, Bauman AE, Oja P.","Br J Sports Med. 2019 Nov 4. pii: bjsports-2018-100493. doi: 10.1136/bjsports-2018-100493. [Epub ahead of print] Review.","Br J Sports Med.  2019","PubMed","citation","PMID:31685526","pubmed","31685526","create date:2019/11/07 | first author:Pedisic Z",
"ICON 2019-International Scientific Tendinopathy Symposium Consensus: There are nine core health-related domains for tendinopathy (CORE DOMAINS): Delphi study of healthcare professionals and patients.","/pubmed/31685525","Vicenzino B, de Vos RJ, Alfredson H, Bahr R, Cook JL, Coombes BK, Fu SN, Gravare Silbernagel K, Grimaldi A, Lewis JS, Maffulli N, Magnusson SP, Malliaras P, Mc Auliffe S, Oei EHG, Purdam C, Rees JD, Rio EK, Scott A, Speed C, Akker-Scheek IVD, Weir A, et al.","Br J Sports Med. 2019 Nov 4. pii: bjsports-2019-100894. doi: 10.1136/bjsports-2019-100894. [Epub ahead of print]","Br J Sports Med.  2019","PubMed","citation","PMID:31685525","pubmed","31685525","create date:2019/11/07 | first author:Vicenzino B",
"Do physical activity and screen time mediate the association between European fathers' and their children's weight status? Cross-sectional data from the Feel4Diabetes-study.","/pubmed/31685028","Latomme J, Huys N, Cardon G, Morgan PJ, Lateva M, Chakarova N, Kivelä J, Lindström J, Androutsos O, González-Gil EM, De Miguel-Etayo P, Nánási A, Kolozsvári LR, Manios Y, De Craemer M; Feel4Diabetes-study group..","Int J Behav Nutr Phys Act. 2019 Nov 4;16(1):100. doi: 10.1186/s12966-019-0864-8.","Int J Behav Nutr Phys Act.  2019","PubMed","citation","PMID:31685028 | PMCID:PMC6829912","pubmed","31685028","create date:2019/11/07 | first author:Latomme J",
"Diagnostic Performance of Magnetic Resonance Imaging for Detecting Meniscal Ramp Lesions in Patients With Anterior Cruciate Ligament Tears: A Systematic Review and Meta-analysis.","/pubmed/31684739","Koo B, Lee SH, Yun SJ, Song JG.","Am J Sports Med. 2019 Nov 4:363546519880528. doi: 10.1177/0363546519880528. [Epub ahead of print]","Am J Sports Med.  2019","PubMed","citation","PMID:31684739","pubmed","31684739","create date:2019/11/07 | first author:Koo B",
"Insufficient Sleep in Young Athletes? Causes, Consequences, and Potential Treatments.","/pubmed/31679145","Fox JL, Scanlan AT, Stanton R, Sargent C.","Sports Med. 2019 Nov 2. doi: 10.1007/s40279-019-01220-8. [Epub ahead of print] Review.","Sports Med.  2019","PubMed","citation","PMID:31679145","pubmed","31679145","create date:2019/11/05 | first author:Fox JL",
"Running to Lower Resting Blood Pressure: A Systematic Review and Meta-analysis.","/pubmed/31677122","Igarashi Y, Nogami Y.","Sports Med. 2019 Nov 1. doi: 10.1007/s40279-019-01209-3. [Epub ahead of print] Review.","Sports Med.  2019","PubMed","citation","PMID:31677122","pubmed","31677122","create date:2019/11/05 | first author:Igarashi Y",
"Effectiveness of physical activity interventions for overweight and obesity during pregnancy: a systematic review of the content of behaviour change interventions.","/pubmed/31675954","Flannery C, Fredrix M, Olander EK, McAuliffe FM, Byrne M, Kearney PM.","Int J Behav Nutr Phys Act. 2019 Nov 1;16(1):97. doi: 10.1186/s12966-019-0859-5. Review.","Int J Behav Nutr Phys Act.  2019","PubMed","citation","PMID:31675954 | PMCID:PMC6825353","pubmed","31675954","create date:2019/11/05 | first author:Flannery C",
"Follow-up of patients after revascularisation for peripheral arterial diseases: a consensus document from the European Society of Cardiology Working Group on Aorta and Peripheral Vascular Diseases and the European Society for Vascular Surgery.","/pubmed/31672063","Venermo M, Sprynger M, Desormais I, Björck M, Brodmann M, Cohnert T, De Carlo M, Espinola-Klein C, Kownator S, Mazzolai L, Naylor R, Vlachopoulos C, Ricco JB, Aboyans V.","Eur J Prev Cardiol. 2019 Dec;26(18):1971-1984. doi: 10.1177/2047487319846999. Epub 2019 Nov 1.","Eur J Prev Cardiol.  2019","PubMed","citation","PMID:31672063","pubmed","31672063","create date:2019/11/02 | first author:Venermo M",
"Native-Osteoarthritic Joint Resident Stem and Progenitor Cells for Cartilage Cell-Based Therapies: A Quantitative Comparison With Respect to Concentration and Biological Performance.","/pubmed/31671273","Mantripragada VP, Bova WA, Piuzzi NS, Boehm C, Obuchowski NA, Midura RJ, Muschler GF.","Am J Sports Med. 2019 Dec;47(14):3521-3530. doi: 10.1177/0363546519880905. Epub 2019 Oct 31.","Am J Sports Med.  2019","PubMed","citation","PMID:31671273","pubmed","31671273","create date:2019/11/02 | first author:Mantripragada VP",
"Anatomic and Biomechanical Evaluation of Ulnar Tunnel Position in Medial Ulnar Collateral Ligament Reconstruction.","/pubmed/31647881","Dutton PH, Banffy MB, Nelson TJ, Metzger MF.","Am J Sports Med. 2019 Dec;47(14):3491-3497. doi: 10.1177/0363546519880182. Epub 2019 Oct 24.","Am J Sports Med.  2019","PubMed","citation","PMID:31647881","pubmed","31647881","create date:2019/10/28 | first author:Dutton PH",
"The Femoral Footprint Position of the Anterior Cruciate Ligament Might Be a Predisposing Factor to a Noncontact Anterior Cruciate Ligament Rupture.","/pubmed/31647682","Dimitriou D, Wang Z, Zou D, Tsai TY, Helmy N.","Am J Sports Med. 2019 Dec;47(14):3365-3372. doi: 10.1177/0363546519878706. Epub 2019 Oct 24.","Am J Sports Med.  2019","PubMed","citation","PMID:31647682","pubmed","31647682","create date:2019/10/28 | first author:Dimitriou D",
"Association Between Temporal Spatial Parameters and Overuse Injury History in Runners: A Systematic Review and Meta-analysis.","/pubmed/31643019","Brindle RA, Taylor JB, Rajek C, Weisbrod A, Ford KR.","Sports Med. 2019 Nov 20. doi: 10.1007/s40279-019-01207-5. [Epub ahead of print] Review. Erratum in: Sports Med. 2019 Nov 19;:. ","Sports Med.  2019","PubMed","citation","PMID:31643019","pubmed","31643019","create date:2019/10/24 | first author:Brindle RA",
"Functional Results and Outcomes After Repair of Partial Proximal Hamstring Avulsions at Midterm Follow-up.","/pubmed/31634433","Arner JW, Freiman H, Mauro CS, Bradley JP.","Am J Sports Med. 2019 Dec;47(14):3436-3443. doi: 10.1177/0363546519879117. Epub 2019 Oct 21.","Am J Sports Med.  2019","PubMed","citation","PMID:31634433","pubmed","31634433","create date:2019/10/22 | first author:Arner JW",
"Sedentarism, Physical Activity, Steps, and Neurotrophic Factors in Obese Children.","/pubmed/31634295","Mora-Gonzalez J, Migueles JH, Esteban-Cornejo I, Cadenas-Sanchez C, Pastor-Villaescusa B, Molina-García P, Rodriguez-Ayllon M, Rico MC, Gil A, Aguilera CM, Escolano-Margarit MV, Gejl AK, Andersen LB, Catena A, Ortega FB.","Med Sci Sports Exerc. 2019 Nov;51(11):2325-2333. doi: 10.1249/MSS.0000000000002064.","Med Sci Sports Exerc.  2019","PubMed","citation","PMID:31634295","pubmed","31634295","create date:2019/10/22 | first author:Mora-Gonzalez J",
"Horizontal Crank Position Affects Economy and Upper Limb Kinematics of Recumbent Handcyclists.","/pubmed/31634293","Stone B, Mason BS, Warner MB, Goosey-Tolfrey VL.","Med Sci Sports Exerc. 2019 Nov;51(11):2265-2273. doi: 10.1249/MSS.0000000000002062.","Med Sci Sports Exerc.  2019","PubMed","citation","PMID:31634293","pubmed","31634293","create date:2019/10/22 | first author:Stone B",
"Translational Medicine: Exercise Physiology Applied to Metabolic Myopathies.","/pubmed/31634290","Grassi B, Porcelli S, Marzorati M.","Med Sci Sports Exerc. 2019 Nov;51(11):2183-2192. doi: 10.1249/MSS.0000000000002056.","Med Sci Sports Exerc.  2019","PubMed","citation","PMID:31634290","pubmed","31634290","create date:2019/10/22 | first author:Grassi B",
"Does Injection of Hyaluronic Acid Protect Against Early Cartilage Injury Seen After Marathon Running? A Randomized Controlled Trial Utilizing High-Field Magnetic Resonance Imaging.","/pubmed/31634003","Nathani A, Gold GE, Monu U, Hargreaves B, Finlay AK, Rubin EB, Safran MR.","Am J Sports Med. 2019 Dec;47(14):3414-3422. doi: 10.1177/0363546519879138. Epub 2019 Oct 21.","Am J Sports Med.  2019","PubMed","citation","PMID:31634003","pubmed","31634003","create date:2019/10/22 | first author:Nathani A",
"Return to Play and Long-term Participation in Pivoting Sports After Anterior Cruciate Ligament Reconstruction.","/pubmed/31633994","Lindanger L, Strand T, Mølster AO, Solheim E, Inderhaug E.","Am J Sports Med. 2019 Dec;47(14):3339-3346. doi: 10.1177/0363546519878159. Epub 2019 Oct 21.","Am J Sports Med.  2019","PubMed","citation","PMID:31633994","pubmed","31633994","create date:2019/10/22 | first author:Lindanger L",
"Defining Minimal Clinically Important Difference and Patient Acceptable Symptom State After Isolated Endoscopic Gluteus Medius Repair.","/pubmed/31618066","Okoroha KR, Beck EC, Nwachukwu BU, Kunze KN, Nho SJ.","Am J Sports Med. 2019 Nov;47(13):3141-3147. doi: 10.1177/0363546519877179. Epub 2019 Oct 16.","Am J Sports Med.  2019","PubMed","citation","PMID:31618066","pubmed","31618066","create date:2019/10/17 | first author:Okoroha KR",
"Location of the Glenoid Defect in Shoulders With Recurrent Posterior Glenohumeral Instability.","/pubmed/31618065","Dekker TJ, Peebles LA, Goldenberg BT, Millett PJ, Bradley JP, Provencher MT.","Am J Sports Med. 2019 Nov;47(13):3051-3056. doi: 10.1177/0363546519876282. Epub 2019 Oct 16.","Am J Sports Med.  2019","PubMed","citation","PMID:31618065","pubmed","31618065","create date:2019/10/17 | first author:Dekker TJ",
"Can the FEAR Index Be Used to Predict Microinstability in Patients Undergoing Hip Arthroscopic Surgery?","/pubmed/31603694","Truntzer JN, Hoppe DJ, Shapiro LM, Safran MR.","Am J Sports Med. 2019 Nov;47(13):3158-3165. doi: 10.1177/0363546519876105. Epub 2019 Oct 11.","Am J Sports Med.  2019","PubMed","citation","PMID:31603694","pubmed","31603694","create date:2019/10/12 | first author:Truntzer JN",
"Survival Analysis of Revision Autologous Chondrocyte Implantation for Failed ACI.","/pubmed/31589471","Ogura T, Bryant T, Merkely G, Mosier BA, Minas T.","Am J Sports Med. 2019 Nov;47(13):3212-3220. doi: 10.1177/0363546519876630. Epub 2019 Oct 7.","Am J Sports Med.  2019","PubMed","citation","PMID:31589471","pubmed","31589471","create date:2019/10/08 | first author:Ogura T",
