Title,URL,Description,Details,ShortDetails,Resource,Type,Identifiers,Db,EntrezUID,Properties
"Cost-effectiveness of healthy eating and/or physical activity promotion in pregnant women at increased risk of gestational diabetes mellitus: economic evaluation alongside the DALI study, a European multicenter randomized controlled trial.","/pubmed/29540227","Broekhuizen K, Simmons D, Devlieger R, van Assche A, Jans G, Galjaard S, Corcoy R, Adelantado JM, Dunne F, Desoye G, Harreiter J, Kautzky-Willer A, Damm P, Mathiesen ER, Jensen DM, Andersen LL, Lapolla A, Dalfra MG, Bertolotto A, Wender-Ozegowska E, Zawiejska A, Hill D, et al.","Int J Behav Nutr Phys Act. 2018 Mar 14;15(1):23. doi: 10.1186/s12966-018-0643-y.","Int J Behav Nutr Phys Act.  2018","PubMed","citation","PMID:29540227 | PMCID:PMC5853142","pubmed","29540227","create date:2018/03/16 | first author:Broekhuizen K",
"The effects of acceptance and commitment therapy on eating behavior and diet delivered through face-to-face contact and a mobile app: a randomized controlled trial.","/pubmed/29482636","Järvelä-Reijonen E, Karhunen L, Sairanen E, Muotka J, Lindroos S, Laitinen J, Puttonen S, Peuhkuri K, Hallikainen M, Pihlajamäki J, Korpela R, Ermes M, Lappalainen R, Kolehmainen M.","Int J Behav Nutr Phys Act. 2018 Feb 27;15(1):22. doi: 10.1186/s12966-018-0654-8.","Int J Behav Nutr Phys Act.  2018","PubMed","citation","PMID:29482636 | PMCID:PMC5828146","pubmed","29482636","create date:2018/02/28 | first author:Järvelä-Reijonen E",
"Development and reliability of a streetscape observation instrument for international use: MAPS-global.","/pubmed/29482633","Cain KL, Geremia CM, Conway TL, Frank LD, Chapman JE, Fox EH, Timperio A, Veitch J, Van Dyck D, Verhoeven H, Reis R, Augusto A, Cerin E, Mellecker RR, Queralt A, Molina-García J, Sallis JF.","Int J Behav Nutr Phys Act. 2018 Feb 26;15(1):19. doi: 10.1186/s12966-018-0650-z.","Int J Behav Nutr Phys Act.  2018","PubMed","citation","PMID:29482633 | PMCID:PMC5828144","pubmed","29482633","create date:2018/02/28 | first author:Cain KL",
"Systematic comparative validation of self-report measures of sedentary time against an objective measure of postural sitting (activPAL).","/pubmed/29482617","Chastin SFM, Dontje ML, Skelton DA, Čukić I, Shaw RJ, Gill JMR, Greig CA, Gale CR, Deary IJ, Der G, Dall PM; Seniors USP team..","Int J Behav Nutr Phys Act. 2018 Feb 26;15(1):21. doi: 10.1186/s12966-018-0652-x.","Int J Behav Nutr Phys Act.  2018","PubMed","citation","PMID:29482617 | PMCID:PMC5828279","pubmed","29482617","create date:2018/02/28 | first author:Chastin SFM",
"Cadence (steps/min) and intensity during ambulation in 6-20 year olds: the CADENCE-kids study.","/pubmed/29482554","Tudor-Locke C, Schuna JM Jr, Han H, Aguiar EJ, Larrivee S, Hsia DS, Ducharme SW, Barreira TV, Johnson WD.","Int J Behav Nutr Phys Act. 2018 Feb 26;15(1):20. doi: 10.1186/s12966-018-0651-y.","Int J Behav Nutr Phys Act.  2018","PubMed","citation","PMID:29482554 | PMCID:PMC5828000","pubmed","29482554","create date:2018/02/28 | first author:Tudor-Locke C",
"Associations within school-based same-sex friendship networks of children's physical activity and sedentary behaviours: a cross-sectional social network analysis.","/pubmed/29467006","Salway RE, Sebire SJ, Solomon-Moore E, Thompson JL, Jago R.","Int J Behav Nutr Phys Act. 2018 Feb 21;15(1):18. doi: 10.1186/s12966-018-0653-9.","Int J Behav Nutr Phys Act.  2018","PubMed","citation","PMID:29467006 | PMCID:PMC5822654","pubmed","29467006","create date:2018/02/23 | first author:Salway RE",
"Modelling the cost differential between healthy and current diets: the New Zealand case study.","/pubmed/29426334","Vandevijvere S, Young N, Mackay S, Swinburn B, Gahegan M.","Int J Behav Nutr Phys Act. 2018 Feb 9;15(1):16. doi: 10.1186/s12966-018-0648-6.","Int J Behav Nutr Phys Act.  2018","PubMed","citation","PMID:29426334 | PMCID:PMC5807767","pubmed","29426334","create date:2018/02/11 | first author:Vandevijvere S",
"Role of parental and environmental characteristics in toddlers' physical activity and screen time: Bayesian analysis of structural equation models.","/pubmed/29426324","Lee EY, Hesketh KD, Rhodes RE, Rinaldi CM, Spence JC, Carson V.","Int J Behav Nutr Phys Act. 2018 Feb 9;15(1):17. doi: 10.1186/s12966-018-0649-5.","Int J Behav Nutr Phys Act.  2018","PubMed","citation","PMID:29426324 | PMCID:PMC5807771","pubmed","29426324","create date:2018/02/11 | first author:Lee EY",
"A systematic literature review of reviews on techniques for physical activity measurement in adults: a DEDIPAC study.","/pubmed/29422051","Dowd KP, Szeklicki R, Minetto MA, Murphy MH, Polito A, Ghigo E, van der Ploeg H, Ekelund U, Maciaszek J, Stemplewski R, Tomczak M, Donnelly AE.","Int J Behav Nutr Phys Act. 2018 Feb 8;15(1):15. doi: 10.1186/s12966-017-0636-2. Review.","Int J Behav Nutr Phys Act.  2018","PubMed","citation","PMID:29422051 | PMCID:PMC5806271","pubmed","29422051","create date:2018/02/10 | first author:Dowd KP",
"Trajectories of self-reported physical activity and predictors during the transition to old age: a 20-year cohort study of British men.","/pubmed/29415729","Aggio D, Papachristou E, Papacosta O, Lennon LT, Ash S, Whincup PH, Wannamethee SG, Jefferis BJ.","Int J Behav Nutr Phys Act. 2018 Feb 7;15(1):14. doi: 10.1186/s12966-017-0642-4.","Int J Behav Nutr Phys Act.  2018","PubMed","citation","PMID:29415729 | PMCID:PMC5803992","pubmed","29415729","create date:2018/02/09 | first author:Aggio D",
"Evaluation of a community-based, family focused healthy weights initiative using the RE-AIM framework.","/pubmed/29373975","Jung ME, Bourne JE, Gainforth HL.","Int J Behav Nutr Phys Act. 2018 Jan 26;15(1):13. doi: 10.1186/s12966-017-0638-0.","Int J Behav Nutr Phys Act.  2018","PubMed","citation","PMID:29373975 | PMCID:PMC5787319","pubmed","29373975","create date:2018/01/28 | first author:Jung ME",
"The REVAMP natural experiment study: the impact of a play-scape installation on park visitation and park-based physical activity.","/pubmed/29368610","Veitch J, Salmon J, Crawford D, Abbott G, Giles-Corti B, Carver A, Timperio A.","Int J Behav Nutr Phys Act. 2018 Jan 25;15(1):10. doi: 10.1186/s12966-017-0625-5.","Int J Behav Nutr Phys Act.  2018","PubMed","citation","PMID:29368610 | PMCID:PMC5784649","pubmed","29368610","create date:2018/01/26 | first author:Veitch J",
"Embedding weight management into safety-net pediatric primary care: randomized controlled trial.","/pubmed/29357894","Wylie-Rosett J, Groisman-Perelstein AE, Diamantis PM, Jimenez CC, Shankar V, Conlon BA, Mossavar-Rahmani Y, Isasi CR, Martin SN, Ginsberg M, Matthan NR, Lichtenstein AH.","Int J Behav Nutr Phys Act. 2018 Jan 22;15(1):12. doi: 10.1186/s12966-017-0639-z.","Int J Behav Nutr Phys Act.  2018","PubMed","citation","PMID:29357894 | PMCID:PMC5778780","pubmed","29357894","create date:2018/01/24 | first author:Wylie-Rosett J",
"Objectively measured active transportation to school and other destinations among 10-13 year olds.","/pubmed/29351802","Williams GC, Borghese MM, Janssen I.","Int J Behav Nutr Phys Act. 2018 Jan 19;15(1):11. doi: 10.1186/s12966-017-0634-4.","Int J Behav Nutr Phys Act.  2018","PubMed","citation","PMID:29351802 | PMCID:PMC5775558","pubmed","29351802","create date:2018/01/21 | first author:Williams GC",
"Hungry to learn: the prevalence and effects of food insecurity on health behaviors and outcomes over time among a diverse sample of university freshmen.","/pubmed/29347963","Bruening M, van Woerden I, Todd M, Laska MN.","Int J Behav Nutr Phys Act. 2018 Jan 18;15(1):9. doi: 10.1186/s12966-018-0647-7.","Int J Behav Nutr Phys Act.  2018","PubMed","citation","PMID:29347963 | PMCID:PMC5774124","pubmed","29347963","create date:2018/01/20 | first author:Bruening M",
"Consumption of sugar-sweetened beverages and artificially sweetened beverages from childhood to adulthood in relation to socioeconomic status - 15 years follow-up in Norway.","/pubmed/29343247","Bolt-Evensen K, Vik FN, Stea TH, Klepp KI, Bere E.","Int J Behav Nutr Phys Act. 2018 Jan 17;15(1):8. doi: 10.1186/s12966-018-0646-8.","Int J Behav Nutr Phys Act.  2018","PubMed","citation","PMID:29343247 | PMCID:PMC5773139","pubmed","29343247","create date:2018/01/19 | first author:Bolt-Evensen K",
"Spatial access to restaurants and grocery stores in relation to frequency of home cooking.","/pubmed/29338756","Pinho MGM, Mackenbach JD, Charreire H, Oppert JM, Bárdos H, Rutter H, Compernolle S, Beulens JWJ, Brug J, Lakerveld J.","Int J Behav Nutr Phys Act. 2018 Jan 16;15(1):6. doi: 10.1186/s12966-017-0640-6.","Int J Behav Nutr Phys Act.  2018","PubMed","citation","PMID:29338756 | PMCID:PMC5771126","pubmed","29338756","create date:2018/01/18 | first author:Pinho MGM",
"Examining within- and across-day relationships between transient and chronic stress and parent food-related parenting practices in a racially/ethnically diverse and immigrant population : Stress types and food-related parenting practices.","/pubmed/29338753","Berge JM, Tate A, Trofholz A, Fertig A, Crow S, Neumark-Sztainer D, Miner M.","Int J Behav Nutr Phys Act. 2018 Jan 16;15(1):7. doi: 10.1186/s12966-017-0629-1.","Int J Behav Nutr Phys Act.  2018","PubMed","citation","PMID:29338753 | PMCID:PMC5771034","pubmed","29338753","create date:2018/01/18 | first author:Berge JM",
"The relationship between home- and individual-level diet quality among African American and Hispanic/Latino households with young children.","/pubmed/29334994","Kong A, Schiffer L, Antonic M, Braunschweig C, Odoms-Young A, Fitzgibbon M.","Int J Behav Nutr Phys Act. 2018 Jan 15;15(1):5. doi: 10.1186/s12966-018-0645-9.","Int J Behav Nutr Phys Act.  2018","PubMed","citation","PMID:29334994 | PMCID:PMC5769425","pubmed","29334994","create date:2018/01/18 | first author:Kong A",
"The effectiveness of a web 2.0 physical activity intervention in older adults - a randomised controlled trial.","/pubmed/29329587","Alley SJ, Kolt GS, Duncan MJ, Caperchione CM, Savage TN, Maeder AJ, Rosenkranz RR, Tague R, Van Itallie AK, Kerry Mummery W, Vandelanotte C.","Int J Behav Nutr Phys Act. 2018 Jan 12;15(1):4. doi: 10.1186/s12966-017-0641-5.","Int J Behav Nutr Phys Act.  2018","PubMed","citation","PMID:29329587 | PMCID:PMC5766986","pubmed","29329587","create date:2018/01/14 | first author:Alley SJ",
"Bidirectional associations between mothers' feeding practices and child eating behaviours.","/pubmed/29325557","Jansen E, Williams KE, Mallan KM, Nicholson JM, Daniels LA.","Int J Behav Nutr Phys Act. 2018 Jan 11;15(1):3. doi: 10.1186/s12966-018-0644-x.","Int J Behav Nutr Phys Act.  2018","PubMed","citation","PMID:29325557 | PMCID:PMC5765660","pubmed","29325557","create date:2018/01/13 | first author:Jansen E",
"Cluster randomized controlled trial of a mobile market intervention to increase fruit and vegetable intake among adults in lower-income communities in North Carolina.","/pubmed/29304862","Leone LA, Tripicchio GL, Haynes-Maslow L, McGuirt J, Grady Smith JS, Armstrong-Brown J, Gizlice Z, Ammerman A.","Int J Behav Nutr Phys Act. 2018 Jan 5;15(1):2. doi: 10.1186/s12966-017-0637-1.","Int J Behav Nutr Phys Act.  2018","PubMed","citation","PMID:29304862 | PMCID:PMC5756418","pubmed","29304862","create date:2018/01/07 | first author:Leone LA",
"Persistent effect at 30-month post intervention of a community-based randomized trial of KM2H(2) in reducing stroke and heart attack among senior hypertensive patients.","/pubmed/29291739","Gong J, Xu Y, Chen X, Yang N, Li F, Yan Y.","Int J Behav Nutr Phys Act. 2018 Jan 2;15(1):1. doi: 10.1186/s12966-017-0635-3.","Int J Behav Nutr Phys Act.  2018","PubMed","citation","PMID:29291739 | PMCID:PMC5749024","pubmed","29291739","create date:2018/01/03 | first author:Gong J",
