Title,URL,Description,Details,ShortDetails,Resource,Type,Identifiers,Db,EntrezUID,Properties
"Exercise Thresholds on Trial: Are They Really Equivalent?","/pubmed/29315165","Caen K, Vermeire K, Bourgois JG, Boone J.","Med Sci Sports Exerc. 2018 Jun;50(6):1277-1284. doi: 10.1249/MSS.0000000000001547.","Med Sci Sports Exerc.  2018","PubMed","citation","PMID:29315165","pubmed","29315165","create date:2018/01/10 | first author:Caen K",
"Effects of Strength Training on Postpubertal Adolescent Distance Runners.","/pubmed/29315164","Blagrove RC, Howe LP, Cushion EJ, Spence A, Howatson G, Pedlar CR, Hayes PR.","Med Sci Sports Exerc. 2018 Jun;50(6):1224-1232. doi: 10.1249/MSS.0000000000001543.","Med Sci Sports Exerc.  2018","PubMed","citation","PMID:29315164","pubmed","29315164","create date:2018/01/10 | first author:Blagrove RC",
"No Effect of Muscle Stretching within a Full, Dynamic Warm-up on Athletic Performance.","/pubmed/29300214","Blazevich AJ, Gill ND, Kvorning T, Kay AD, Goh AG, Hilton B, Drinkwater EJ, Behm DG.","Med Sci Sports Exerc. 2018 Jun;50(6):1258-1266. doi: 10.1249/MSS.0000000000001539.","Med Sci Sports Exerc.  2018","PubMed","citation","PMID:29300214","pubmed","29300214","create date:2018/01/05 | first author:Blazevich AJ",
"Declining Physical Activity and Motivation from Middle School to High School.","/pubmed/29298219","Dishman RK, McIver KL, Dowda M, Pate RR.","Med Sci Sports Exerc. 2018 Jun;50(6):1206-1215. doi: 10.1249/MSS.0000000000001542.","Med Sci Sports Exerc.  2018","PubMed","citation","PMID:29298219 | PMCID:PMC5953776","pubmed","29298219","create date:2018/01/04 | first author:Dishman RK",
"Community-level Sports Group Participation and Older Individuals' Depressive Symptoms.","/pubmed/29298218","Tsuji T, Miyaguni Y, Kanamori S, Hanazato M, Kondo K.","Med Sci Sports Exerc. 2018 Jun;50(6):1199-1205. doi: 10.1249/MSS.0000000000001541.","Med Sci Sports Exerc.  2018","PubMed","citation","PMID:29298218 | PMCID:PMC6023572","pubmed","29298218","create date:2018/01/04 | first author:Tsuji T",
"Can Functional Movement Assessment Predict Football Head Impact Biomechanics?","/pubmed/29293120","Ford JM, Campbell KR, Ford CB, Boyd KE, Padua DA, Mihalik JP.","Med Sci Sports Exerc. 2018 Jun;50(6):1233-1240. doi: 10.1249/MSS.0000000000001538.","Med Sci Sports Exerc.  2018","PubMed","citation","PMID:29293120","pubmed","29293120","create date:2018/01/03 | first author:Ford JM",
"Female Athlete Issues for the Team Physician: A Consensus Statement-2017 Update.","/pubmed/29652732","[No authors listed]","Med Sci Sports Exerc. 2018 May;50(5):1113-1122. doi: 10.1249/MSS.0000000000001603. No abstract available. ","Med Sci Sports Exerc.  2018","PubMed","citation","PMID:29652732","pubmed","29652732","create date:2018/04/14",
"Physical Activity and Bone Accretion: Isotemporal Modeling and Genetic Interactions.","/pubmed/29465475","Mitchell JA, Chesi A, McCormack SE, Cousminer DL, Kalkwarf HJ, Lappe JM, Gilsanz V, Oberfield SE, Shepherd JA, Kelly A, Grant SFA, Zemel BS.","Med Sci Sports Exerc. 2018 May;50(5):977-986. doi: 10.1249/MSS.0000000000001520.","Med Sci Sports Exerc.  2018","PubMed","citation","PMID:29465475 | PMCID:PMC5899052","pubmed","29465475","create date:2018/02/22 | first author:Mitchell JA",
"Sex Differences in Mechanisms of Recovery after Isometric and Dynamic Fatiguing Tasks.","/pubmed/29298217","Senefeld J, Pereira HM, Elliott N, Yoon T, Hunter SK.","Med Sci Sports Exerc. 2018 May;50(5):1070-1083. doi: 10.1249/MSS.0000000000001537.","Med Sci Sports Exerc.  2018","PubMed","citation","PMID:29298217 | PMCID:PMC5899026","pubmed","29298217","create date:2018/01/04 | first author:Senefeld J",
"The Effects of Sex and Motoneuron Pool on Central Fatigue.","/pubmed/29283935","Yacyshyn AF, Nettleton J, McNeil CJ.","Med Sci Sports Exerc. 2018 May;50(5):1061-1069. doi: 10.1249/MSS.0000000000001536.","Med Sci Sports Exerc.  2018","PubMed","citation","PMID:29283935","pubmed","29283935","create date:2017/12/29 | first author:Yacyshyn AF",
"Raw and Count Data Comparability of Hip-Worn ActiGraph GT3X+ and Link Accelerometers.","/pubmed/29283934","Montoye AHK, Nelson MB, Bock JM, Imboden MT, Kaminsky LA, Mackintosh KA, McNarry MA, Pfeiffer KA.","Med Sci Sports Exerc. 2018 May;50(5):1103-1112. doi: 10.1249/MSS.0000000000001534.","Med Sci Sports Exerc.  2018","PubMed","citation","PMID:29283934","pubmed","29283934","create date:2017/12/29 | first author:Montoye AHK",
"A Preventive Model for Muscle Injuries: A Novel Approach based on Learning Algorithms.","/pubmed/29283933","López-Valenciano A, Ayala F, Puerta JM, DE Ste Croix MBA, Vera-Garcia FJ, Hernández-Sánchez S, Ruiz-Pérez I, Myer GD.","Med Sci Sports Exerc. 2018 May;50(5):915-927. doi: 10.1249/MSS.0000000000001535.","Med Sci Sports Exerc.  2018","PubMed","citation","PMID:29283933","pubmed","29283933","create date:2017/12/29 | first author:López-Valenciano A",
"Exercise Increases Glucose Transporter-4 Levels on Peripheral Blood Mononuclear Cells.","/pubmed/29271848","Sticka KD, Schnurr TM, Jerome SP, Dajles A, Reynolds AJ, Duffy LK, Knall CM, Dunlap KL.","Med Sci Sports Exerc. 2018 May;50(5):938-944. doi: 10.1249/MSS.0000000000001528.","Med Sci Sports Exerc.  2018","PubMed","citation","PMID:29271848 | PMCID:PMC5899035","pubmed","29271848","create date:2017/12/23 | first author:Sticka KD",
"Estimating Energy Expenditure with ActiGraph GT9X Inertial Measurement Unit.","/pubmed/29271847","Hibbing PR, Lamunion SR, Kaplan AS, Crouter SE.","Med Sci Sports Exerc. 2018 May;50(5):1093-1102. doi: 10.1249/MSS.0000000000001532.","Med Sci Sports Exerc.  2018","PubMed","citation","PMID:29271847","pubmed","29271847","create date:2017/12/23 | first author:Hibbing PR",
"Lower-Limb Dominance, Performance, and Fiber Type in Resistance-trained Men.","/pubmed/29271846","Arevalo JA, Lynn SK, Bagley JR, Brown LE, Costa PB, Galpin AJ.","Med Sci Sports Exerc. 2018 May;50(5):1054-1060. doi: 10.1249/MSS.0000000000001533.","Med Sci Sports Exerc.  2018","PubMed","citation","PMID:29271846","pubmed","29271846","create date:2017/12/23 | first author:Arevalo JA",
"Role of Chronic Stress and Exercise on Microvascular Function in Metabolic Syndrome.","/pubmed/29271845","Branyan KW, Devallance ER, Lemaster KA, Skinner RC, Bryner RW, Olfert IM, Kelley EE, Frisbee JC, Chantler PD.","Med Sci Sports Exerc. 2018 May;50(5):957-966. doi: 10.1249/MSS.0000000000001531.","Med Sci Sports Exerc.  2018","PubMed","citation","PMID:29271845 | PMCID:PMC5898979","pubmed","29271845","create date:2017/12/23 | first author:Branyan KW",
"Predictive Modeling of Hamstring Strain Injuries in Elite Australian Footballers.","/pubmed/29266094","Ruddy JD, Shield AJ, Maniar N, Williams MD, Duhig S, Timmins RG, Hickey J, Bourne MN, Opar DA.","Med Sci Sports Exerc. 2018 May;50(5):906-914. doi: 10.1249/MSS.0000000000001527.","Med Sci Sports Exerc.  2018","PubMed","citation","PMID:29266094","pubmed","29266094","create date:2017/12/22 | first author:Ruddy JD",
"Benefits of Resistance Training with Blood Flow Restriction in Knee Osteoarthritis.","/pubmed/29266093","Ferraz RB, Gualano B, Rodrigues R, Kurimori CO, Fuller R, Lima FR, DE Sá-Pinto AL, Roschel H.","Med Sci Sports Exerc. 2018 May;50(5):897-905. doi: 10.1249/MSS.0000000000001530.","Med Sci Sports Exerc.  2018","PubMed","citation","PMID:29266093","pubmed","29266093","create date:2017/12/22 | first author:Ferraz RB",
"Effect of Carbohydrate Mouth Rinse on Performance after Prolonged Submaximal Cycling.","/pubmed/29266092","Jensen M, Klimstra M, Sporer B, Stellingwerff T.","Med Sci Sports Exerc. 2018 May;50(5):1031-1038. doi: 10.1249/MSS.0000000000001529.","Med Sci Sports Exerc.  2018","PubMed","citation","PMID:29266092","pubmed","29266092","create date:2017/12/22 | first author:Jensen M",
"The Effectiveness of Progressive Aerobic Interval Training in Cardiac Rehabilitation.","/pubmed/29257009","Lee LS, Tsai MC, Oh PI, Brooks D.","Med Sci Sports Exerc. 2018 May;50(5):881-888. doi: 10.1249/MSS.0000000000001526.","Med Sci Sports Exerc.  2018","PubMed","citation","PMID:29257009","pubmed","29257009","create date:2017/12/20 | first author:Lee LS",
"Lower-Extremity Injury Increases Risk of First-Time Low Back Pain in the US Army.","/pubmed/29252971","Seay JF, Shing T, Wilburn K, Westrick R, Kardouni JR.","Med Sci Sports Exerc. 2018 May;50(5):987-994. doi: 10.1249/MSS.0000000000001523.","Med Sci Sports Exerc.  2018","PubMed","citation","PMID:29252971","pubmed","29252971","create date:2017/12/19 | first author:Seay JF",
"Physical Education Classes, Physical Activity, and Sedentary Behavior in Children.","/pubmed/29252970","Silva DAS, Chaput JP, Katzmarzyk PT, Fogelholm M, Hu G, Maher C, Olds T, Onywera V, Sarmiento OL, Standage M, Tudor-Locke C, Tremblay MS.","Med Sci Sports Exerc. 2018 May;50(5):995-1004. doi: 10.1249/MSS.0000000000001524.","Med Sci Sports Exerc.  2018","PubMed","citation","PMID:29252970","pubmed","29252970","create date:2017/12/19 | first author:Silva DAS",
"Differences in Hip and Knee Running Moments across Female Pubertal Development.","/pubmed/29252969","Sayer TA, Hinman RS, Fortin K, Paterson KL, Bennell KL, Timmi A, Pivonka P, Bryant AL.","Med Sci Sports Exerc. 2018 May;50(5):1015-1020. doi: 10.1249/MSS.0000000000001525.","Med Sci Sports Exerc.  2018","PubMed","citation","PMID:29252969","pubmed","29252969","create date:2017/12/19 | first author:Sayer TA",
"Synchronizing Gait with Cardiac Cycle Phase Alters Heart Rate Response during Running.","/pubmed/29240004","Constantini K, Stickford ASL, Bleich JL, Mannheimer PD, Levine BD, Chapman RF.","Med Sci Sports Exerc. 2018 May;50(5):1046-1053. doi: 10.1249/MSS.0000000000001515.","Med Sci Sports Exerc.  2018","PubMed","citation","PMID:29240004 | PMCID:PMC6023589","pubmed","29240004","create date:2017/12/15 | first author:Constantini K",
"PRIME: A Novel Low-Mass, High-Repetition Approach to Improve Function in Older Adults.","/pubmed/29232316","Allen JD, Vanbruggen MD, Johannsen NM, Robbins JL, Credeur DP, Pieper CF, Sloane R, Earnest CP, Church TS, Ravussin E, Kraus WE, Welsch MA.","Med Sci Sports Exerc. 2018 May;50(5):1005-1014. doi: 10.1249/MSS.0000000000001518.","Med Sci Sports Exerc.  2018","PubMed","citation","PMID:29232316 | PMCID:PMC5899050","pubmed","29232316","create date:2017/12/13 | first author:Allen JD",
"Beneficial Effects of Exercise Pretreatment in a Sporadic Alzheimer's Rat Model.","/pubmed/29232315","Wu C, Yang L, Tucker D, Dong Y, Zhu L, Duan R, Liu TC, Zhang Q.","Med Sci Sports Exerc. 2018 May;50(5):945-956. doi: 10.1249/MSS.0000000000001519.","Med Sci Sports Exerc.  2018","PubMed","citation","PMID:29232315 | PMCID:PMC5899011","pubmed","29232315","create date:2017/12/13 | first author:Wu C",
"Postexercise Fructose-Maltodextrin Ingestion Enhances Subsequent Endurance Capacity.","/pubmed/29232314","Maunder E, Podlogar T, Wallis GA.","Med Sci Sports Exerc. 2018 May;50(5):1039-1045. doi: 10.1249/MSS.0000000000001516.","Med Sci Sports Exerc.  2018","PubMed","citation","PMID:29232314","pubmed","29232314","create date:2017/12/13 | first author:Maunder E",
"Replacement of Sedentary Time with Physical Activity: Effect on Lipoproteins.","/pubmed/29219943","Phillips CM, Dillon CB, Perry IJ.","Med Sci Sports Exerc. 2018 May;50(5):967-976. doi: 10.1249/MSS.0000000000001511.","Med Sci Sports Exerc.  2018","PubMed","citation","PMID:29219943","pubmed","29219943","create date:2017/12/09 | first author:Phillips CM",
"Three Weeks of Overload Training Increases Resting Muscle Sympathetic Activity.","/pubmed/29206785","Coates AM, Incognito AV, Seed JD, Doherty CJ, Millar PJ, Burr JF.","Med Sci Sports Exerc. 2018 May;50(5):928-937. doi: 10.1249/MSS.0000000000001514.","Med Sci Sports Exerc.  2018","PubMed","citation","PMID:29206785","pubmed","29206785","create date:2017/12/06 | first author:Coates AM",
"Effect of Beta-blocker Treatment on V˙O2peak in Patients with Heart Failure.","/pubmed/29206784","Montero D, Flammer AJ.","Med Sci Sports Exerc. 2018 May;50(5):889-896. doi: 10.1249/MSS.0000000000001513.","Med Sci Sports Exerc.  2018","PubMed","citation","PMID:29206784","pubmed","29206784","create date:2017/12/06 | first author:Montero D",
"Protocol for Objective Measurement of Infants' Physical Activity using Accelerometry.","/pubmed/29206783","Ricardo LIC, DA Silva ICM, Martins RC, Wendt A, Gonçalves H, Hallal PRC, Wehrmeister FC.","Med Sci Sports Exerc. 2018 May;50(5):1084-1092. doi: 10.1249/MSS.0000000000001512.","Med Sci Sports Exerc.  2018","PubMed","citation","PMID:29206783 | PMCID:PMC5849301","pubmed","29206783","create date:2017/12/06 | first author:Ricardo LIC",
"Perceptual Responses to High- and Moderate-Intensity Interval Exercise in Adolescents.","/pubmed/29206781","Malik AA, Williams CA, Weston KL, Barker AR.","Med Sci Sports Exerc. 2018 May;50(5):1021-1030. doi: 10.1249/MSS.0000000000001508.","Med Sci Sports Exerc.  2018","PubMed","citation","PMID:29206781","pubmed","29206781","create date:2017/12/06 | first author:Malik AA",
"Heat Loss is Impaired in Older Men on the Day following Prolonged Work in the Heat.","/pubmed/29683926","Notley SR, Meade RD, DʼSouza AW, Friesen BJ, Kenny GP.","Med Sci Sports Exerc. 2018 Apr 21. doi: 10.1249/MSS.0000000000001643. [Epub ahead of print]","Med Sci Sports Exerc.  2018","PubMed","citation","PMID:29683926","pubmed","29683926","create date:2018/04/24 | first author:Notley SR",
"CA-MRSA Infection Rates and Management among Student-Athletes.","/pubmed/29683924","Braun T, Kahanov L.","Med Sci Sports Exerc. 2018 Apr 21. doi: 10.1249/MSS.0000000000001649. [Epub ahead of print]","Med Sci Sports Exerc.  2018","PubMed","citation","PMID:29683924","pubmed","29683924","create date:2018/04/24 | first author:Braun T",
"Prediction of Mortality in Adolescents with Cystic Fibrosis-Corrigendum.","/pubmed/29547500","[No authors listed]","Med Sci Sports Exerc. 2018 Apr;50(4):880. doi: 10.1249/MSS.0000000000001557. No abstract available. ","Med Sci Sports Exerc.  2018","PubMed","citation","PMID:29547500","pubmed","29547500","create date:2018/03/17",
"Short-Term Exercise Training Alters Leukocyte Chemokine Receptors in Obese Adults-Corrigendum.","/pubmed/29547499","[No authors listed]","Med Sci Sports Exerc. 2018 Apr;50(4):879. doi: 10.1249/MSS.0000000000001556. No abstract available. ","Med Sci Sports Exerc.  2018","PubMed","citation","PMID:29547499","pubmed","29547499","create date:2018/03/17",
"Response.","/pubmed/29547498","Chomistek AK, Bassett DR Jr.","Med Sci Sports Exerc. 2018 Apr;50(4):877. doi: 10.1249/MSS.0000000000001510. No abstract available. ","Med Sci Sports Exerc.  2018","PubMed","citation","PMID:29547498","pubmed","29547498","create date:2018/03/17 | first author:Chomistek AK",
"Steps per Day and Its Relationship to Energy Expenditures.","/pubmed/29547497","Barreira TV, Schuna JM Jr.","Med Sci Sports Exerc. 2018 Apr;50(4):876. doi: 10.1249/MSS.0000000000001509. No abstract available. ","Med Sci Sports Exerc.  2018","PubMed","citation","PMID:29547497","pubmed","29547497","create date:2018/03/17 | first author:Barreira TV",
"Response.","/pubmed/29547496","Whitfield J, Heigenhauser GJF, van Loon LJC, Spriet LL, Tupling AR, Holloway GP.","Med Sci Sports Exerc. 2018 Apr;50(4):875. doi: 10.1249/MSS.0000000000001490. No abstract available. ","Med Sci Sports Exerc.  2018","PubMed","citation","PMID:29547496","pubmed","29547496","create date:2018/03/17 | first author:Whitfield J",
"Dietary Nitrate and Muscle Function in Humans: Acute versus Chronic Mechanisms.","/pubmed/29547495","Coggan AR.","Med Sci Sports Exerc. 2018 Apr;50(4):874. doi: 10.1249/MSS.0000000000001489. No abstract available. ","Med Sci Sports Exerc.  2018","PubMed","citation","PMID:29547495","pubmed","29547495","create date:2018/03/17 | first author:Coggan AR",
"True Responders in Exercise Science: Novel Insight from Replicated Crossover Designs.","/pubmed/29547494","Betts JA, Gonzalez JT.","Med Sci Sports Exerc. 2018 Apr;50(4):769. doi: 10.1249/MSS.0000000000001549. No abstract available. ","Med Sci Sports Exerc.  2018","PubMed","citation","PMID:29547494","pubmed","29547494","create date:2018/03/17 | first author:Betts JA",
"Interindividual Responses of Appetite to Acute Exercise: A Replicated Crossover Study.","/pubmed/29240652","Goltz FR, Thackray AE, King JA, Dorling JL, Atkinson G, Stensel DJ.","Med Sci Sports Exerc. 2018 Apr;50(4):758-768. doi: 10.1249/MSS.0000000000001504.","Med Sci Sports Exerc.  2018","PubMed","citation","PMID:29240652","pubmed","29240652","create date:2017/12/15 | first author:Goltz FR",
"Acute Impact of Different Exercise Modalities on Arterial and Platelet Function.","/pubmed/29240651","Haynes A, Linden MD, Robey E, Watts GF, Barrett PHR, Naylor LH, Green DJ.","Med Sci Sports Exerc. 2018 Apr;50(4):785-791. doi: 10.1249/MSS.0000000000001505.","Med Sci Sports Exerc.  2018","PubMed","citation","PMID:29240651","pubmed","29240651","create date:2017/12/15 | first author:Haynes A",
"Association between Physical Activity and Adiposity in Adolescents with Down Syndrome.","/pubmed/29210918","Pitchford EA, Adkins C, Hasson RE, Hornyak JE, Ulrich DA.","Med Sci Sports Exerc. 2018 Apr;50(4):667-674. doi: 10.1249/MSS.0000000000001502.","Med Sci Sports Exerc.  2018","PubMed","citation","PMID:29210918 | PMCID:PMC5856599","pubmed","29210918","create date:2017/12/07 | first author:Pitchford EA",
"Link between Physical Activity Type in Adolescence and Body Composition in Adulthood.","/pubmed/29210917","Belanger M, Katapally TR, Barnett TA, O'Loughlin E, Sabiston CM, O'Loughlin J.","Med Sci Sports Exerc. 2018 Apr;50(4):709-714. doi: 10.1249/MSS.0000000000001503.","Med Sci Sports Exerc.  2018","PubMed","citation","PMID:29210917","pubmed","29210917","create date:2017/12/07 | first author:Belanger M",
"Acute Inflammatory Responses to Exercise in Patients with Abdominal Aortic Aneurysm.","/pubmed/29210916","Windsor MT, Bailey TG, Perissiou M, Greaves K, Jha P, Leicht AS, Russell FD, Golledge J, Askew CD.","Med Sci Sports Exerc. 2018 Apr;50(4):649-658. doi: 10.1249/MSS.0000000000001501.","Med Sci Sports Exerc.  2018","PubMed","citation","PMID:29210916","pubmed","29210916","create date:2017/12/07 | first author:Windsor MT",
"Muscle Fiber and Performance Changes after Fast Eccentric Complex Training.","/pubmed/29206782","Bogdanis GC, Tsoukos A, Brown LE, Selima E, Veligekas P, Spengos K, Terzis G.","Med Sci Sports Exerc. 2018 Apr;50(4):729-738. doi: 10.1249/MSS.0000000000001507.","Med Sci Sports Exerc.  2018","PubMed","citation","PMID:29206782","pubmed","29206782","create date:2017/12/06 | first author:Bogdanis GC",
"The Interplay between Genes and Psychosocial Home Environment on Physical Activity.","/pubmed/29194096","Aaltonen S, Kaprio J, Kujala UM, Pulkkinen L, Rose RJ, Silventoinen K.","Med Sci Sports Exerc. 2018 Apr;50(4):691-699. doi: 10.1249/MSS.0000000000001506.","Med Sci Sports Exerc.  2018","PubMed","citation","PMID:29194096 | PMCID:PMC5856601","pubmed","29194096","create date:2017/12/02 | first author:Aaltonen S",
"The Role of Airway Inflammation and Bronchial Hyperresponsiveness in Athlete's Asthma.","/pubmed/29189668","Stang J, Sikkeland LIB, Tufvesson E, Holm AM, Stensrud T, Carlsen KH.","Med Sci Sports Exerc. 2018 Apr;50(4):659-666. doi: 10.1249/MSS.0000000000001478.","Med Sci Sports Exerc.  2018","PubMed","citation","PMID:29189668","pubmed","29189668","create date:2017/12/01 | first author:Stang J",
"Strength, Affect Regulation, and Subcortical Morphology in Military Pilots.","/pubmed/29166323","Cárdenas D, Madinabeitia I, Vera J, Perales JC, García-Ramos A, Ortega E, Catena-Verdejo E, Catena A.","Med Sci Sports Exerc. 2018 Apr;50(4):722-728. doi: 10.1249/MSS.0000000000001500.","Med Sci Sports Exerc.  2018","PubMed","citation","PMID:29166323","pubmed","29166323","create date:2017/11/23 | first author:Cárdenas D",
"Biological/Genetic Regulation of Physical Activity Level: Consensus from GenBioPAC.","/pubmed/29166322","Lightfoot JT, DE Geus EJC, Booth FW, Bray MS, DEN Hoed M, Kaprio J, Kelly SA, Pomp D, Saul MC, Thomis MA, Garland T Jr, Bouchard C.","Med Sci Sports Exerc. 2018 Apr;50(4):863-873. doi: 10.1249/MSS.0000000000001499. Review.","Med Sci Sports Exerc.  2018","PubMed","citation","PMID:29166322","pubmed","29166322","create date:2017/11/23 | first author:Lightfoot JT",
"Adipose Lipolysis Unchanged by Preexercise Carbohydrate Regardless of Glycemic Index.","/pubmed/29166321","Baur DA, Willingham BD, Smith KA, Kisiolek JN, Morrissey MC, Saracino PG, Ragland TJ, Ormsbee MJ.","Med Sci Sports Exerc. 2018 Apr;50(4):827-836. doi: 10.1249/MSS.0000000000001498.","Med Sci Sports Exerc.  2018","PubMed","citation","PMID:29166321","pubmed","29166321","create date:2017/11/23 | first author:Baur DA",
"Exercise Alters Gut Microbiota Composition and Function in Lean and Obese Humans.","/pubmed/29166320","Allen JM, Mailing LJ, Niemiro GM, Moore R, Cook MD, White BA, Holscher HD, Woods JA.","Med Sci Sports Exerc. 2018 Apr;50(4):747-757. doi: 10.1249/MSS.0000000000001495.","Med Sci Sports Exerc.  2018","PubMed","citation","PMID:29166320","pubmed","29166320","create date:2017/11/23 | first author:Allen JM",
"Associations between BMI Change and Cardiometabolic Risk in Retired Football Players.","/pubmed/29140900","Trexler ET, Smith-Ryan AE, Defreese JD, Marshall SW, Guskiewicz KM, Kerr ZY.","Med Sci Sports Exerc. 2018 Apr;50(4):684-690. doi: 10.1249/MSS.0000000000001492.","Med Sci Sports Exerc.  2018","PubMed","citation","PMID:29140900","pubmed","29140900","create date:2017/11/16 | first author:Trexler ET",
"Isotemporal Substitution of Sedentary Behavior and Physical Activity on Function.","/pubmed/29140899","Lerma NL, Cho CC, Swartz AM, Miller NE, Keenan KG, Strath SJ.","Med Sci Sports Exerc. 2018 Apr;50(4):792-800. doi: 10.1249/MSS.0000000000001491.","Med Sci Sports Exerc.  2018","PubMed","citation","PMID:29140899 | PMCID:PMC5856586","pubmed","29140899","create date:2017/11/16 | first author:Lerma NL",
"A Construct Validation Study of PLAYfun.","/pubmed/29140898","Cairney J, Veldhuizen S, Graham JD, Rodriguez C, Bedard C, Bremer E, Kriellaars D.","Med Sci Sports Exerc. 2018 Apr;50(4):855-862. doi: 10.1249/MSS.0000000000001494.","Med Sci Sports Exerc.  2018","PubMed","citation","PMID:29140898","pubmed","29140898","create date:2017/11/16 | first author:Cairney J",
"Psychological and Psychophysiological Effects of Recuperative Music Postexercise.","/pubmed/29140897","Karageorghis CI, Bruce AC, Pottratz ST, Stevens RC, Bigliassi M, Hamer M.","Med Sci Sports Exerc. 2018 Apr;50(4):739-746. doi: 10.1249/MSS.0000000000001497.","Med Sci Sports Exerc.  2018","PubMed","citation","PMID:29140897","pubmed","29140897","create date:2017/11/16 | first author:Karageorghis CI",
"Cold Water Ingestion Improves Exercise Tolerance of Heat-Sensitive People with MS.","/pubmed/29140896","Chaseling GK, Filingeri D, Barnett M, Hoang P, Davis SL, Jay O.","Med Sci Sports Exerc. 2018 Apr;50(4):643-648. doi: 10.1249/MSS.0000000000001496.","Med Sci Sports Exerc.  2018","PubMed","citation","PMID:29140896","pubmed","29140896","create date:2017/11/16 | first author:Chaseling GK",
"A Primer on the Use of Equivalence Testing for Evaluating Measurement Agreement.","/pubmed/29135817","Dixon PM, Saint-Maurice PF, Kim Y, Hibbing P, Bai Y, Welk GJ.","Med Sci Sports Exerc. 2018 Apr;50(4):837-845. doi: 10.1249/MSS.0000000000001481.","Med Sci Sports Exerc.  2018","PubMed","citation","PMID:29135817 | PMCID:PMC5856600","pubmed","29135817","create date:2017/11/15 | first author:Dixon PM",
"Dopaminergic Genetic Variants and Voluntary Externally Paced Exercise Behavior.","/pubmed/29135816","VAN DER Mee DJ, Fedko IO, Hottenga JJ, Ehli EA, VAN DER Zee MD, Ligthart L, VAN Beijsterveldt TCEM, Davies GE, Bartels M, Landers JG, DE Geus EJC.","Med Sci Sports Exerc. 2018 Apr;50(4):700-708. doi: 10.1249/MSS.0000000000001479.","Med Sci Sports Exerc.  2018","PubMed","citation","PMID:29135816 | PMCID:PMC5856580","pubmed","29135816","create date:2017/11/15 | first author:VAN DER Mee DJ",
"Muscle Strength Influences Pressor Responses to Static Handgrip in Men and Women.","/pubmed/29135658","Notay K, Lee JB, Incognito AV, Seed JD, Arthurs AA, Millar PJ.","Med Sci Sports Exerc. 2018 Apr;50(4):778-784. doi: 10.1249/MSS.0000000000001485.","Med Sci Sports Exerc.  2018","PubMed","citation","PMID:29135658","pubmed","29135658","create date:2017/11/15 | first author:Notay K",
"Adapted Sojourn Models to Estimate Activity Intensity in Youth: A Suite of Tools.","/pubmed/29135657","Hibbing PR, Ellingson LD, Dixon PM, Welk GJ.","Med Sci Sports Exerc. 2018 Apr;50(4):846-854. doi: 10.1249/MSS.0000000000001486.","Med Sci Sports Exerc.  2018","PubMed","citation","PMID:29135657","pubmed","29135657","create date:2017/11/15 | first author:Hibbing PR",
"Sex Differences in Cardiac Baroreflex Sensitivity after Isometric Handgrip Exercise.","/pubmed/29135601","Teixeira AL, Ritti-Dias R, Antonino D, Bottaro M, Millar PJ, Vianna LC.","Med Sci Sports Exerc. 2018 Apr;50(4):770-777. doi: 10.1249/MSS.0000000000001487.","Med Sci Sports Exerc.  2018","PubMed","citation","PMID:29135601","pubmed","29135601","create date:2017/11/15 | first author:Teixeira AL",
"Metabolic and Performance Effects of Yerba Mate on Well-trained Cyclists.","/pubmed/29117073","Areta JL, Austarheim I, Wangensteen H, Capelli C.","Med Sci Sports Exerc. 2018 Apr;50(4):817-826. doi: 10.1249/MSS.0000000000001482.","Med Sci Sports Exerc.  2018","PubMed","citation","PMID:29117073","pubmed","29117073","create date:2017/11/09 | first author:Areta JL",
"Workplace Strategies to Prevent Sitting-induced Endothelial Dysfunction.","/pubmed/29117072","Kruse NT, Hughes WE, Benzo RM, Carr LJ, Casey DP.","Med Sci Sports Exerc. 2018 Apr;50(4):801-808. doi: 10.1249/MSS.0000000000001484.","Med Sci Sports Exerc.  2018","PubMed","citation","PMID:29117072","pubmed","29117072","create date:2017/11/09 | first author:Kruse NT",
